{
  "invoice_number": "INV-100000",
  "date": "2025-11-21",
  "total": 12345.00,
  "vendor": "Sample Vendor Large",
  "line_items": [
    {"desc": "Item 1", "qty": 1, "price": 100.00},
    {"desc": "Item 2", "qty": 2, "price": 200.00},
    {"desc": "Item 3", "qty": 3, "price": 300.00},
    {"desc": "Item 4", "qty": 4, "price": 400.00},
    {"desc": "Item 5", "qty": 5, "price": 500.00},
    {"desc": "Item 6", "qty": 6, "price": 600.00},
    {"desc": "Item 7", "qty": 7, "price": 700.00},
    {"desc": "Item 8", "qty": 8, "price": 800.00},
    {"desc": "Item 9", "qty": 9, "price": 900.00},
    {"desc": "Item 10", "qty": 10, "price": 1000.00},
    {"desc": "Item 11", "qty": 11, "price": 1100.00},
    {"desc": "Item 12", "qty": 12, "price": 1200.00},
    {"desc": "Item 13", "qty": 13, "price": 1300.00},
    {"desc": "Item 14", "qty": 14, "price": 1400.00},
    {"desc": "Item 15", "qty": 15, "price": 1500.00},
    {"desc": "Item 16", "qty": 16, "price": 1600.00},
    {"desc": "Item 17", "qty": 17, "price": 1700.00},
    {"desc": "Item 18", "qty": 18, "price": 1800.00},
    {"desc": "Item 19", "qty": 19, "price": 1900.00},
    {"desc": "Item 20", "qty": 20, "price": 2000.00},
    {"desc": "Item 21", "qty": 21, "price": 2100.00},
    {"desc": "Item 22", "qty": 22, "price": 2200.00},
    {"desc": "Item 23", "qty": 23, "price": 2300.00},
    {"desc": "Item 24", "qty": 24, "price": 2400.00},
    {"desc": "Item 25", "qty": 25, "price": 2500.00},
    {"desc": "Item 26", "qty": 26, "price": 2600.00},
    {"desc": "Item 27", "qty": 27, "price": 2700.00},
    {"desc": "Item 28", "qty": 28, "price": 2800.00},
    {"desc": "Item 29", "qty": 29, "price": 2900.00},
    {"desc": "Item 30", "qty": 30, "price": 3000.00},
    {"desc": "Item 31", "qty": 31, "price": 3100.00},
    {"desc": "Item 32", "qty": 32, "price": 3200.00},
    {"desc": "Item 33", "qty": 33, "price": 3300.00},
    {"desc": "Item 34", "qty": 34, "price": 3400.00},
    {"desc": "Item 35", "qty": 35, "price": 3500.00},
    {"desc": "Item 36", "qty": 36, "price": 3600.00},
    {"desc": "Item 37", "qty": 37, "price": 3700.00},
    {"desc": "Item 38", "qty": 38, "price": 3800.00},
    {"desc": "Item 39", "qty": 39, "price": 3900.00},
    {"desc": "Item 40", "qty": 40, "price": 4000.00},
    {"desc": "Item 41", "qty": 41, "price": 4100.00},
    {"desc": "Item 42", "qty": 42, "price": 4200.00},
    {"desc": "Item 43", "qty": 43, "price": 4300.00},
    {"desc": "Item 44", "qty": 44, "price": 4400.00},
    {"desc": "Item 45", "qty": 45, "price": 4500.00},
    {"desc": "Item 46", "qty": 46, "price": 4600.00},
    {"desc": "Item 47", "qty": 47, "price": 4700.00},
    {"desc": "Item 48", "qty": 48, "price": 4800.00},
    {"desc": "Item 49", "qty": 49, "price": 4900.00},
    {"desc": "Item 50", "qty": 50, "price": 5000.00},
    {"desc": "Item 51", "qty": 51, "price": 5100.00},
    {"desc": "Item 52", "qty": 52, "price": 5200.00},
    {"desc": "Item 53", "qty": 53, "price": 5300.00},
    {"desc": "Item 54", "qty": 54, "price": 5400.00},
    {"desc": "Item 55", "qty": 55, "price": 5500.00},
    {"desc": "Item 56", "qty": 56, "price": 5600.00},
    {"desc": "Item 57", "qty": 57, "price": 5700.00},
    {"desc": "Item 58", "qty": 58, "price": 5800.00},
    {"desc": "Item 59", "qty": 59, "price": 5900.00},
    {"desc": "Item 60", "qty": 60, "price": 6000.00},
    {"desc": "Item 61", "qty": 61, "price": 6100.00},
    {"desc": "Item 62", "qty": 62, "price": 6200.00},
    {"desc": "Item 63", "qty": 63, "price": 6300.00},
    {"desc": "Item 64", "qty": 64, "price": 6400.00},
    {"desc": "Item 65", "qty": 65, "price": 6500.00},
    {"desc": "Item 66", "qty": 66, "price": 6600.00},
    {"desc": "Item 67", "qty": 67, "price": 6700.00},
    {"desc": "Item 68", "qty": 68, "price": 6800.00},
    {"desc": "Item 69", "qty": 69, "price": 6900.00},
    {"desc": "Item 70", "qty": 70, "price": 7000.00},
    {"desc": "Item 71", "qty": 71, "price": 7100.00},
    {"desc": "Item 72", "qty": 72, "price": 7200.00},
    {"desc": "Item 73", "qty": 73, "price": 7300.00},
    {"desc": "Item 74", "qty": 74, "price": 7400.00},
    {"desc": "Item 75", "qty": 75, "price": 7500.00},
    {"desc": "Item 76", "qty": 76, "price": 7600.00},
    {"desc": "Item 77", "qty": 77, "price": 7700.00},
    {"desc": "Item 78", "qty": 78, "price": 7800.00},
    {"desc": "Item 79", "qty": 79, "price": 7900.00},
    {"desc": "Item 80", "qty": 80, "price": 8000.00},
    {"desc": "Item 81", "qty": 81, "price": 8100.00},
    {"desc": "Item 82", "qty": 82, "price": 8200.00},
    {"desc": "Item 83", "qty": 83, "price": 8300.00},
    {"desc": "Item 84", "qty": 84, "price": 8400.00},
    {"desc": "Item 85", "qty": 85, "price": 8500.00},
    {"desc": "Item 86", "qty": 86, "price": 8600.00},
    {"desc": "Item 87", "qty": 87, "price": 8700.00},
    {"desc": "Item 88", "qty": 88, "price": 8800.00},
    {"desc": "Item 89", "qty": 89, "price": 8900.00},
    {"desc": "Item 90", "qty": 90, "price": 9000.00},
    {"desc": "Item 91", "qty": 91, "price": 9100.00},
    {"desc": "Item 92", "qty": 92, "price": 9200.00},
    {"desc": "Item 93", "qty": 93, "price": 9300.00},
    {"desc": "Item 94", "qty": 94, "price": 9400.00},
    {"desc": "Item 95", "qty": 95, "price": 9500.00},
    {"desc": "Item 96", "qty": 96, "price": 9600.00},
    {"desc": "Item 97", "qty": 97, "price": 9700.00},
    {"desc": "Item 98", "qty": 98, "price": 9800.00},
    {"desc": "Item 99", "qty": 99, "price": 9900.00},
    {"desc": "Item 100", "qty": 100, "price": 10000.00}
  ]
}
